{
  "$schema": "../../../schemas/human-reviews.schema.json",
  "schemaVersion": 1,
  "runId": "2026-08-08T014738Z-openrouter-meta-muse-spark-1-2-opencode",
  "updatedAt": "2026-08-08T02:45:51.875356Z",
  "reviews": [
    {
      "reviewId": "ef41159e-b472-414c-a508-955efeac8d9d",
      "reviewerName": "Adam",
      "createdAt": "2026-08-08T02:45:45.210Z",
      "updatedAt": "2026-08-08T02:45:51.875356Z",
      "problems": [
        {
          "file": "problem-01.sgf",
          "status": "completed",
          "valid": false,
          "realistic": null,
          "duplicate": null,
          "wellPathed": null,
          "estimatedDifficulty": null,
          "quality": null,
          "reviewedAt": "2026-08-08T02:45:51.859Z"
        },
        {
          "file": "problem-02.sgf",
          "status": "completed",
          "valid": false,
          "realistic": null,
          "duplicate": null,
          "wellPathed": null,
          "estimatedDifficulty": null,
          "quality": null,
          "reviewedAt": "2026-08-08T02:45:51.859Z"
        },
        {
          "file": "problem-03.sgf",
          "status": "completed",
          "valid": false,
          "realistic": null,
          "duplicate": null,
          "wellPathed": null,
          "estimatedDifficulty": null,
          "quality": null,
          "reviewedAt": "2026-08-08T02:45:51.859Z"
        },
        {
          "file": "problem-04.sgf",
          "status": "completed",
          "valid": false,
          "realistic": null,
          "duplicate": null,
          "wellPathed": null,
          "estimatedDifficulty": null,
          "quality": null,
          "reviewedAt": "2026-08-08T02:45:51.859Z"
        },
        {
          "file": "problem-05.sgf",
          "status": "completed",
          "valid": false,
          "realistic": null,
          "duplicate": null,
          "wellPathed": null,
          "estimatedDifficulty": null,
          "quality": null,
          "reviewedAt": "2026-08-08T02:45:51.859Z"
        },
        {
          "file": "problem-06.sgf",
          "status": "completed",
          "valid": false,
          "realistic": null,
          "duplicate": null,
          "wellPathed": null,
          "estimatedDifficulty": null,
          "quality": null,
          "reviewedAt": "2026-08-08T02:45:51.859Z"
        },
        {
          "file": "problem-07.sgf",
          "status": "completed",
          "valid": false,
          "realistic": null,
          "duplicate": null,
          "wellPathed": null,
          "estimatedDifficulty": null,
          "quality": null,
          "reviewedAt": "2026-08-08T02:45:51.859Z"
        },
        {
          "file": "problem-08.sgf",
          "status": "completed",
          "valid": false,
          "realistic": null,
          "duplicate": null,
          "wellPathed": null,
          "estimatedDifficulty": null,
          "quality": null,
          "reviewedAt": "2026-08-08T02:45:51.859Z"
        },
        {
          "file": "problem-09.sgf",
          "status": "completed",
          "valid": false,
          "realistic": null,
          "duplicate": null,
          "wellPathed": null,
          "estimatedDifficulty": null,
          "quality": null,
          "reviewedAt": "2026-08-08T02:45:51.859Z"
        },
        {
          "file": "problem-10.sgf",
          "status": "completed",
          "valid": false,
          "realistic": null,
          "duplicate": null,
          "wellPathed": null,
          "estimatedDifficulty": null,
          "quality": null,
          "reviewedAt": "2026-08-08T02:45:51.859Z"
        }
      ]
    }
  ]
}
